{
  "$schema": "../../schemas/recipe.schema.v1.json",
  "schemaVersion": "1.0",
  "recipeId": "recipe.combine-masked-conditioning-properties",
  "locale": "ru",
  "title": "Основная и масочная conditioning-ветви",
  "summary": "Сохраняет базовый cond, добавляет mask metadata к cond_NEW и соединяет списки в порядке base + processed new.",
  "body": "ru.md",
  "difficulty": "advanced",
  "articleIds": ["core.conditioning-set-properties-and-combine", "core.conditioning-set-mask", "core.conditioning-combine"],
  "requirements": [
    "ComfyUI 0.32.0",
    "Два совместимых значения CONDITIONING",
    "MASK для новой ветви",
    "Реальный sampler-граф для проверки перекрытия условий"
  ],
  "fragment": {
    "id": "fragment.combine-masked-conditioning-properties",
    "path": "fragment.json",
    "format": "nodes-wizard-fragment/1.0"
  },
  "editorial": {
    "state": "in_review",
    "reviewedBy": "Automated source, runtime and Russian editorial pass; human approval pending",
    "reviewedAt": "2026-08-13"
  },
  "sources": [
    {
      "title": "ConditioningSetPropertiesAndCombine in ComfyUI v0.32.0",
      "url": "https://github.com/Comfy-Org/ComfyUI/blob/c2bcbecd82ec5ae66594340b395c24ef0217b238/comfy_extras/nodes_hooks.py#L117-L147",
      "publisher": "Comfy-Org",
      "accessedAt": "2026-08-13"
    },
    {
      "title": "Property application and combination helper in ComfyUI v0.32.0",
      "url": "https://github.com/Comfy-Org/ComfyUI/blob/c2bcbecd82ec5ae66594340b395c24ef0217b238/comfy/hooks.py#L672-L773",
      "publisher": "Comfy-Org",
      "accessedAt": "2026-08-13"
    },
    {
      "title": "Official workflow templates JSON 0.1.42",
      "url": "https://pypi.org/project/comfyui-workflow-templates-json/0.1.42/",
      "publisher": "Comfy-Org",
      "accessedAt": "2026-08-13"
    }
  ]
}
