{
  "$schema": "../../schemas/recipe.schema.v1.json",
  "schemaVersion": "1.0",
  "recipeId": "recipe.combine-conditioning-pair-with-properties",
  "locale": "ru",
  "title": "Добавить пару условий в области маски",
  "summary": "Оставляет базовую пару без изменений, перезаписывает у новой пары маску с силой 0,25 и общий диапазон времени.",
  "body": "ru.md",
  "difficulty": "advanced",
  "articleIds": ["core.pair-conditioning-set-properties-and-combine"],
  "requirements": [
    "ComfyUI 0.32.0",
    "Базовая и новая пары CONDITIONING",
    "MASK и TIMESTEPS_RANGE подходящей формы",
    "Необязательная группа HOOKS для новой пары"
  ],
  "fragment": {
    "id": "fragment.combine-conditioning-pair-with-properties",
    "path": "fragment.json",
    "format": "nodes-wizard-fragment/1.0"
  },
  "editorial": {
    "state": "in_review",
    "reviewedBy": "Автоматизированная сверка закреплённых исходников и серверной схемы; порядок и перезапись свойств новых записей проверены на синтетических данных, полный граф не исполнялся, human approval pending",
    "reviewedAt": "2026-08-14"
  },
  "sources": [
    {
      "title": "PairConditioningSetPropertiesAndCombine в ComfyUI 0.32.0",
      "url": "https://github.com/Comfy-Org/ComfyUI/blob/c2bcbecd82ec5ae66594340b395c24ef0217b238/comfy_extras/nodes_hooks.py#L51-L84",
      "publisher": "Comfy-Org",
      "accessedAt": "2026-08-14"
    },
    {
      "title": "Обработка и объединение новой пары",
      "url": "https://github.com/Comfy-Org/ComfyUI/blob/c2bcbecd82ec5ae66594340b395c24ef0217b238/comfy/hooks.py#L743-L771",
      "publisher": "Comfy-Org",
      "accessedAt": "2026-08-14"
    },
    {
      "title": "Сила маски в семплере",
      "url": "https://github.com/Comfy-Org/ComfyUI/blob/c2bcbecd82ec5ae66594340b395c24ef0217b238/comfy/samplers.py#L33-L116",
      "publisher": "Comfy-Org",
      "accessedAt": "2026-08-14"
    }
  ]
}
