{"$schema":"../../schemas/recipe.schema.v1.json","schemaVersion":"1.0","recipeId":"recipe.array-to-json-compact","locale":"ru","title":"Массив в однострочный JSON","summary":"Сериализует внешний ARRAY с indent 0; стандартные пробелы json.dumps после разделителей сохраняются.","body":"ru.md","difficulty":"beginner","articleIds":["core.convert-array-to-string"],"requirements":["ComfyUI 0.32.0 или совместимая версия","JSON-совместимые элементы массива"],"fragment":{"id":"fragment.array-to-json-compact","path":"fragment.json","format":"nodes-wizard-fragment/1.0"},"editorial":{"state":"draft","reviewedBy":"Automated pinned source/runtime/docs review; source-derived fragment, human approval pending","reviewedAt":"2026-08-20"},"sources":[{"title":"ConvertArrayToString source","url":"https://github.com/Comfy-Org/ComfyUI/blob/c2bcbecd82ec5ae66594340b395c24ef0217b238/comfy_extras/nodes_string.py#L471-L491","publisher":"Comfy-Org","accessedAt":"2026-08-20"}]}
