{
  "$schema": "../../schemas/recipe.schema.v1.json",
  "schemaVersion": "1.0",
  "recipeId": "recipe.dpmpp-2s-ancestral-custom-sampling",
  "locale": "ru",
  "title": "DPM++ 2S ancestral для SamplerCustomAdvanced",
  "summary": "Source-derived fragment создаёт DPM++ 2S ancestral с eta 1 и s_noise 1 и передаёт SAMPLER в custom sampling.",
  "body": "ru.md",
  "difficulty": "advanced",
  "articleIds": ["core.sampler-dpmpp-2s-ancestral"],
  "requirements": [
    "ComfyUI 0.32.0 или совместимая версия",
    "Совместимые NOISE, GUIDER, SIGMAS и LATENT",
    "Проверка отдельной RF/CONST ветви для flow-моделей"
  ],
  "fragment": {
    "id": "fragment.dpmpp-2s-ancestral-custom-sampling",
    "path": "fragment.json",
    "format": "nodes-wizard-fragment/1.0"
  },
  "editorial": {
    "state": "in_review",
    "reviewedBy": "Automated pinned source/runtime/schema review and exhaustive official-workflow absence check; model execution and human approval pending",
    "reviewedAt": "2026-08-14"
  },
  "sources": [
    {
      "title": "SamplerDPMPP_2S_Ancestral in ComfyUI v0.32.0",
      "url": "https://github.com/Comfy-Org/ComfyUI/blob/c2bcbecd82ec5ae66594340b395c24ef0217b238/comfy_extras/nodes_custom_sampler.py#L474-L492",
      "publisher": "Comfy-Org",
      "accessedAt": "2026-08-14"
    },
    {
      "title": "Official workflow templates JSON 0.1.42: exhaustive absence census",
      "url": "https://pypi.org/project/comfyui-workflow-templates-json/0.1.42/",
      "publisher": "Comfy-Org",
      "accessedAt": "2026-08-14"
    }
  ]
}
