{"$schema":"../../schemas/recipe.schema.v1.json","schemaVersion":"1.0","recipeId":"recipe.hidream-o1-empty-latent","locale":"ru","title":"Холст HiDream-O1 2048×2048","summary":"Создаёт нулевой трёхканальный латент в проверенном официальном разрешении.","body":"ru.md","difficulty":"beginner","articleIds":["core.empty-hidream-o1-latent-image"],"requirements":["ComfyUI 0.32.0"],"fragment":{"id":"fragment.hidream-o1-empty-latent","path":"fragment.json","format":"nodes-wizard-fragment/1.0"},"editorial":{"state":"draft","reviewedBy":"Исходник, схема и четыре официальных экземпляра проверены; полный граф не исполнялся","reviewedAt":"2026-08-20"},"sources":[{"title":"HiDream-O1 workflow templates","url":"https://github.com/Comfy-Org/workflow_templates/tree/cca1ea5ea4560108ecc2f44dee951f41ea433062/templates","publisher":"Comfy-Org","accessedAt":"2026-08-20"}]}
