{"$schema":"../../schemas/recipe.schema.v1.json","schemaVersion":"1.0","recipeId":"recipe.draw-detection-boxes","locale":"ru","title":"Нарисовать detection-рамки","summary":"Накладывает внешний BBOX на исходный IMAGE без дополнительных настроек.","body":"ru.md","difficulty":"intermediate","articleIds":["core.draw-bboxes","core.rtdetr-detect"],"requirements":["ComfyUI 0.32.0","IMAGE и BBOX"],"fragment":{"id":"fragment.draw-detection-boxes","path":"fragment.json","format":"nodes-wizard-fragment/1.0"},"editorial":{"state":"draft","reviewedBy":"Automated source/runtime/workflow validation; visual execution and human approval pending","reviewedAt":"2026-08-20"},"sources":[{"title":"DrawBBoxes source","url":"https://github.com/Comfy-Org/ComfyUI/blob/c2bcbecd82ec5ae66594340b395c24ef0217b238/comfy_extras/nodes_rtdetr.py#L68-L143","publisher":"Comfy-Org","accessedAt":"2026-08-20"}]}
