{"$schema":"../../schemas/recipe.schema.v1.json","schemaVersion":"1.0","recipeId":"recipe.extract-model-diff-lora","locale":"ru","title":"Извлечь LoRA из разности MODEL","summary":"Строит standard LoRA ранга 8 из внешнего MODEL diff и сохраняет bias-разности.","body":"ru.md","difficulty":"advanced","articleIds":["core.lora-save","core.model-merge-subtract"],"requirements":["ComfyUI 0.32.0","MODEL diff из ModelMergeSubtract"],"fragment":{"id":"fragment.extract-model-diff-lora","path":"fragment.json","format":"nodes-wizard-fragment/1.0"},"editorial":{"state":"draft","reviewedBy":"Automated pinned source/runtime validation; real weights and human approval pending","reviewedAt":"2026-08-20"},"sources":[{"title":"LoraSave source","url":"https://github.com/Comfy-Org/ComfyUI/blob/c2bcbecd82ec5ae66594340b395c24ef0217b238/comfy_extras/nodes_lora_extract.py#L14-L134","publisher":"Comfy-Org","accessedAt":"2026-08-20"}]}
