{
  "$schema": "../../schemas/recipe.schema.v1.json",
  "schemaVersion": "1.0",
  "recipeId": "recipe.blend-two-clip-encoders",
  "locale": "ru",
  "title": "Смешать два совместимых CLIP",
  "summary": "Создаёт CLIPMergeSimple с ratio 0.70: общие веса получают 70% от clip1 и 30% от clip2, а tokenizer и структура остаются от первого входа.",
  "body": "ru.md",
  "difficulty": "advanced",
  "articleIds": ["core.clip-merge-simple"],
  "requirements": [
    "ComfyUI 0.32.0 или совместимая версия",
    "Два CLIP одной архитектуры с совпадающими формами параметров",
    "Контрольный prompt и bypass-ветка для сравнения"
  ],
  "fragment": {"id": "fragment.blend-two-clip-encoders", "path": "fragment.json", "format": "nodes-wizard-fragment/1.0"},
  "editorial": {
    "state": "draft",
    "reviewedBy": "Automated pinned source/runtime/docs and exhaustive zero-case workflow review; exact patch algebra probe passed, real encoder execution and human approval pending",
    "reviewedAt": "2026-08-13"
  },
  "sources": [
    {
      "title": "CLIPMergeSimple implementation in ComfyUI v0.32.0",
      "url": "https://github.com/Comfy-Org/ComfyUI/blob/c2bcbecd82ec5ae66594340b395c24ef0217b238/comfy_extras/nodes_model_merging.py#L71-L90",
      "publisher": "Comfy-Org",
      "accessedAt": "2026-08-13"
    },
    {
      "title": "Official workflow templates JSON 0.1.42",
      "url": "https://pypi.org/project/comfyui-workflow-templates-json/0.1.42/",
      "publisher": "Comfy-Org",
      "accessedAt": "2026-08-13"
    }
  ]
}
