{
  "$schema": "../../schemas/recipe.schema.v1.json",
  "schemaVersion": "1.0",
  "recipeId": "recipe.inspect-unet-cross-attention-v",
  "locale": "ru",
  "title": "Проверить v в перекрёстном внимании UNet",
  "summary": "Оставляет q, k и out равными 1, а v снижает до 0,9 для контролируемого сравнения одной группы проекций attn2.",
  "body": "ru.md",
  "difficulty": "advanced",
  "articleIds": ["core.unet-cross-attention-multiply"],
  "requirements": ["ComfyUI 0.32.0", "Совместимый MODEL с ключами attn2.to_v", "Контрольная ветвь без ноды", "Одинаковые conditioning, seed и сэмплер"],
  "fragment": {"id": "fragment.inspect-unet-cross-attention-v", "path": "fragment.json", "format": "nodes-wizard-fragment/1.0"},
  "editorial": {
    "state": "in_review",
    "reviewedBy": "Автоматизированная проверка исходника, runtime-схемы и соединений; полный граф и модель не запускались, редактор пока не утвердил материал вручную",
    "reviewedAt": "2026-08-14"
  },
  "sources": [
    {
      "title": "UNetCrossAttentionMultiply в ComfyUI v0.32.0",
      "url": "https://github.com/Comfy-Org/ComfyUI/blob/c2bcbecd82ec5ae66594340b395c24ef0217b238/comfy_extras/nodes_attention_multiply.py#L46-L66",
      "publisher": "Comfy-Org",
      "accessedAt": "2026-08-14"
    }
  ]
}
