{
  "$schema": "../../schemas/recipe.schema.v1.json",
  "schemaVersion": "1.0",
  "recipeId": "recipe.save-point-cloud-source",
  "locale": "ru",
  "title": "Сохранить готовый point-cloud PLY",
  "summary": "Source-derived fragment подключает point-cloud File3D и живой viewport к SavePointCloud, сохраняя PLY без разбора и перекодирования.",
  "body": "ru.md",
  "difficulty": "intermediate",
  "articleIds": ["core.save-point-cloud"],
  "requirements": [
    "ComfyUI 0.32.0 и frontend 1.48.7",
    "Point-cloud File3D в формате PLY",
    "Рабочий Load3D-виджет в браузере"
  ],
  "fragment": {"id": "fragment.save-point-cloud-source", "path": "fragment.json", "format": "nodes-wizard-fragment/1.0"},
  "editorial": {
    "state": "draft",
    "reviewedBy": "Automated pinned backend/frontend/runtime/docs review and exact-source PLY output-copy probe; official wheel has no SavePointCloud case, real PLY browser rendering and human approval pending",
    "reviewedAt": "2026-08-14"
  },
  "sources": [
    {
      "title": "SavePointCloud in ComfyUI v0.32.0",
      "url": "https://github.com/Comfy-Org/ComfyUI/blob/c2bcbecd82ec5ae66594340b395c24ef0217b238/comfy_extras/nodes_save_3d.py#L409-L561",
      "publisher": "Comfy-Org",
      "accessedAt": "2026-08-14"
    },
    {
      "title": "SavePointCloud frontend integration 1.48.7",
      "url": "https://github.com/Comfy-Org/ComfyUI_frontend/blob/6d6af63c00f132cd25dc29307fc56bd2c094fa22/src/extensions/core/load3dPreviewExtensions.ts#L25-L254",
      "publisher": "Comfy-Org",
      "accessedAt": "2026-08-14"
    }
  ]
}
