{
  "$schema": "../../schemas/recipe.schema.v1.json",
  "schemaVersion": "1.0",
  "recipeId": "recipe.extend-intermediate-sigmas",
  "locale": "ru",
  "title": "Добавить линейные точки в верхнюю часть SIGMAS",
  "summary": "Вставляет одну линейную точку в каждый интервал, чья текущая sigma не ниже 12, и передаёт расширенное расписание в SamplerCustomAdvanced.",
  "body": "ru.md",
  "difficulty": "advanced",
  "articleIds": ["core.extend-intermediate-sigmas"],
  "requirements": [
    "Внешняя проверенная последовательность SIGMAS",
    "NOISE, GUIDER, SAMPLER и LATENT для SamplerCustomAdvanced"
  ],
  "fragment": {"id": "fragment.extend-intermediate-sigmas", "path": "fragment.json", "format": "nodes-wizard-fragment/1.0"},
  "editorial": {
    "state": "draft",
    "reviewedBy": "Автоматизированная проверка pinned method, runtime-портов и полного zero-census; полный sampling и ручная редакторская проверка не выполнены",
    "reviewedAt": "2026-08-14"
  },
  "sources": [
    {
      "title": "ExtendIntermediateSigmas implementation in ComfyUI v0.32.0",
      "url": "https://github.com/Comfy-Org/ComfyUI/blob/c2bcbecd82ec5ae66594340b395c24ef0217b238/comfy_extras/nodes_custom_sampler.py#L297-L348",
      "publisher": "Comfy-Org",
      "accessedAt": "2026-08-14"
    }
  ]
}
