{
  "$schema": "../../schemas/recipe.schema.v1.json",
  "schemaVersion": "1.0",
  "recipeId": "recipe.shuffle-video-text-seed-29",
  "locale": "ru",
  "title": "Перемешать пары видео–подпись с seed 29",
  "summary": "ShuffleVideoTextDataset с seed 29 переупорядочивает списки VIDEO и STRING по общим индексам, не меняя кадры внутри роликов.",
  "body": "ru.md",
  "difficulty": "intermediate",
  "articleIds": ["core.shuffle-video-text-dataset"],
  "requirements": [
    "ComfyUI 0.32.0",
    "Списки VIDEO и STRING одинаковой длины",
    "Проверенное соответствие элементов по исходному индексу",
    "Выборочный просмотр пар после перестановки"
  ],
  "fragment": {
    "id": "fragment.shuffle-video-text-seed-29",
    "path": "fragment.json",
    "format": "nodes-wizard-fragment/1.0"
  },
  "editorial": {
    "state": "in_review",
    "reviewedBy": "Automated source, runtime, full workflow census, exact paired-list execution and Russian editorial pass; human approval pending",
    "reviewedAt": "2026-08-14"
  },
  "sources": [
    {
      "title": "ShuffleVideoTextDataset in ComfyUI v0.32.0",
      "url": "https://github.com/Comfy-Org/ComfyUI/blob/c2bcbecd82ec5ae66594340b395c24ef0217b238/comfy_extras/nodes_dataset.py#L1399-L1445",
      "publisher": "Comfy-Org",
      "accessedAt": "2026-08-14"
    },
    {
      "title": "Official workflow templates JSON 0.1.42",
      "url": "https://pypi.org/project/comfyui-workflow-templates-json/0.1.42/",
      "publisher": "Comfy-Org",
      "accessedAt": "2026-08-14"
    }
  ]
}
