{"$schema":"../../schemas/recipe.schema.v1.json","schemaVersion":"1.0","recipeId":"recipe.save-text-json-output","locale":"ru","title":"Сохранение JSON в output","summary":"Сохраняет внешний STRING как Text/report_#####.json; корректный JSON форматируется, некорректный записывается без изменений.","body":"ru.md","difficulty":"beginner","articleIds":["core.save-text"],"requirements":["ComfyUI 0.32.0 или совместимая версия","Доступ на запись в output"],"fragment":{"id":"fragment.save-text-json-output","path":"fragment.json","format":"nodes-wizard-fragment/1.0"},"editorial":{"state":"draft","reviewedBy":"Automated pinned source/runtime/docs/workflow review and safe temp-directory probe; human approval pending","reviewedAt":"2026-08-20"},"sources":[{"title":"SaveText source in ComfyUI v0.32.0","url":"https://github.com/Comfy-Org/ComfyUI/blob/c2bcbecd82ec5ae66594340b395c24ef0217b238/comfy_extras/nodes_text.py#L8-L72","publisher":"Comfy-Org","accessedAt":"2026-08-20"}]}
