{"$schema":"../../schemas/recipe.schema.v1.json","schemaVersion":"1.0","recipeId":"recipe.empty-ace-step-15-latent-audio-local-check","locale":"ru","title":"EmptyAceStep1.5LatentAudio: пустой аудиолатент ACE-Step 1.5: локальная проверочная заготовка","summary":"Добавляет одну ноду с точными обязательными портами и безопасными значениями виджетов из закреплённой схемы runtime.","body":"ru.md","difficulty":"advanced","articleIds":["core.empty-ace-step-15-latent-audio"],"requirements":["ComfyUI 0.32.0 или совместимая версия","Локальные модели и входные данные, необходимые этой ноде"],"fragment":{"id":"fragment.empty-ace-step-15-latent-audio-local-check","path":"fragment.json","format":"nodes-wizard-fragment/1.0"},"editorial":{"state":"draft","reviewedBy":"Автоматизированная сверка схемы runtime; исполнение полного графа и человеческое утверждение ожидаются","reviewedAt":"2026-08-20"},"sources":[{"title":"ACE nodes source","url":"https://github.com/Comfy-Org/ComfyUI/blob/c2bcbecd82ec5ae66594340b395c24ef0217b238/comfy_extras/nodes_ace.py#L89-L109","publisher":"Comfy-Org","accessedAt":"2026-08-20"}]}
