{
  "$schema": "../../schemas/recipe.schema.v1.json",
  "schemaVersion": "1.0",
  "recipeId": "recipe.tome-token-merge-30",
  "locale": "ru",
  "title": "ToMe с коэффициентом 0,30",
  "summary": "Добавляет к MODEL текущий патч слияния токенов ComfyUI с начальным коэффициентом 0,30 для контролируемого сравнения.",
  "body": "ru.md",
  "difficulty": "advanced",
  "articleIds": ["core.tome-patch-model"],
  "requirements": ["ComfyUI 0.32.0", "MODEL с совместимыми attn1 hooks", "контрольная ветвь без патча"],
  "fragment": {"id": "fragment.tome-token-merge-30", "path": "fragment.json", "format": "nodes-wizard-fragment/1.0"},
  "editorial": {"state": "in_review", "reviewedBy": "Automated exact-source tensor behavior, runtime schema, no-official-case census and Russian editorial review; model benchmark and human approval pending", "reviewedAt": "2026-08-14"},
  "sources": [
    {"title": "TomePatchModel in ComfyUI v0.32.0", "url": "https://github.com/Comfy-Org/ComfyUI/blob/c2bcbecd82ec5ae66594340b395c24ef0217b238/comfy_extras/nodes_tomesd.py#L149-L178", "publisher": "Comfy-Org", "accessedAt": "2026-08-14"},
    {"title": "Token Merging for Fast Stable Diffusion", "url": "https://arxiv.org/abs/2303.17604v1", "publisher": "arXiv", "accessedAt": "2026-08-14"}
  ]
}
