{"$schema":"../../schemas/recipe.schema.v1.json","schemaVersion":"1.0","recipeId":"recipe.convert-text-case-title","locale":"ru","title":"Title Case для строки","summary":"Применяет Python title() к короткому заголовку; результат следует правилам Unicode Python, а не редакционному справочнику.","body":"ru.md","difficulty":"beginner","articleIds":["core.case-converter"],"requirements":["ComfyUI 0.32.0 или совместимая версия"],"fragment":{"id":"fragment.convert-text-case-title","path":"fragment.json","format":"nodes-wizard-fragment/1.0"},"editorial":{"state":"draft","reviewedBy":"Automated pinned source/runtime/docs review; source-derived fragment, human approval pending","reviewedAt":"2026-08-20"},"sources":[{"title":"CaseConverter in ComfyUI v0.32.0","url":"https://github.com/Comfy-Org/ComfyUI/blob/c2bcbecd82ec5ae66594340b395c24ef0217b238/comfy_extras/nodes_string.py#L106-L136","publisher":"Comfy-Org","accessedAt":"2026-08-20"}]}
